姓名,专业班级,所在学院,项目中的分工,成员类型,
刘灵芝,计算机科学与技术,计算机学院,建立应用系统详细的深度学习模型描述，构建算法应用开发框架,；软件功能模块的架构和集成设计,；整理研究应用成果、相关数据，撰写开发应用文档。,第一主持人,
姜沄,人工智能,计算机学院,建立应用系统详细的深度学习模型描述，构建算法应用开发框架；软件功能模块的架构和集成设计；,整理研究应用成果、相关数据，撰写开发应用文档。,第二主持人,
周瑞,计算机科学与技术,计算机学院,学习SQL数据库语言以及服务器搭建技术，数据加密技术，预估数据库规模；开发客户端，搭建服务器；完善和更新数据库，维护服务器。,成员,
林点,计算机科学与技术,计算机学院,收集和整理图像识别算法和开源库资料，规划研究学习路线，查阅相关文献；设计实现基于深度学习的COVID-19胸片快速诊断识别系统主体功能模块和检测分析模块;提高识别系统精度，上线新冠快识的检测成像功能。,成员,
刘兴源,信息安全,计算机学院,收集和整理图像识别算法和开源库资料，规划研究学习路线，查阅相关文献；设计实现基于深度学习的COVID-19胸片快速诊断识别系统主体功能模块和检测分析模块;提高识别系统精度，上线新冠快识的检测成像功能。,成员,
姓名,职称,指导教师类型,
景国良,副教授,第一指导教师,
高尚,教授,指导教师,
